Sweden,SWE,"Manufacturing, value added (annual % growth)",NV.IND.MANF.KD.ZG,-2.00583753247184,6.80635148743734,1.82318045785379,3.05082391584499,2.98426872716139,-1.14971071444597,-6.22645244104643,19.1849435341598,4.82614022256425,-5.54776460144654,..
Sweden,SWE,"Manufacturing, value added (constant 2015 US$)",NV.IND.MANF.KD,64648296959.5653,69048487281.2755,70307365807.8314,72452319738.4973,74614491658.5563,73756640853.4285,69164218688.5763,82433334989.8225,86411683326.5674,81617766547.462,..
Sweden,SWE,"Manufacturing, value added (constant LCU)",NV.IND.MANF.KN,545298095000,582413000000,593031440000,611123785000,629361361000,622125526000,583389176000,695312060000,728868795000,688432870000,..
Sweden,SWE,"Manufacturing, value added (current LCU)",NV.IND.MANF.CN,517023000000,582413000000,593432000000,611116000000,640854000000,661186000000,634680000000,736311000000,823164000000,880750000000,..
Sweden,SWE,"Manufacturing, value added (current US$)",NV.IND.MANF.CD,75359160795.7399,69048487281.2755,69310041764.0366,71485079932.1898,73724779796.2654,69905010731.7001,68909739949.1729,85851486308.623,81386548288.1554,83010048139.9926,..
Sweden,SWE,Market capitalization of listed domestic companies (% of GDP),CM.MKT.LCAP.GD.ZS,..,..,..,..,..,..,..,..,..,..,..
Sweden,SWE,Market capitalization of listed domestic companies (current US$),CM.MKT.LCAP.CD,..,..,..,..,..,..,..,..,..,..,..
Sweden,SWE,Medium and high-tech manufacturing value added (% manufacturing value added),NV.MNF.TECH.ZS.UN,44.6492383942387,51.6130067185023,50.94211670814,51.1084456719175,51.6174430393255,51.8851553846131,50.3101861468966,49.0938754724323,49.929251915495,..,..
Sweden,SWE,Monetary Sector credit to private sector (% GDP),FM.AST.PRVT.GD.ZS,130.317333651556,127.493031834385,128.880999343135,132.490229454798,132.864761636077,131.506604922317,138.235180476792,135.618447701284,134.945545863567,127.818932494431,..
Sweden,SWE,Multidimensional poverty headcount ratio (UNDP) (% of population),SI.POV.MPUN,..,..,..,..,..,..,..,..,..,..,..
Sweden,SWE,Multidimensional poverty headcount ratio (World Bank) (% of population),SI.POV.MPWB,1.1,1.3,1.4,1,1.7,2.3,2.2,1.5,2.4,..,..
Sweden,SWE,Multilateral debt service (% of public and publicly guaranteed debt service),DT.TDS.MLAT.PG.ZS,..,..,..,..,..,..,..,..,..,..,..
Sweden,SWE,"Multilateral debt service (TDS, current US$)",DT.TDS.MLAT.CD,..,..,..,..,..,..,..,..,..,..,..
Sweden,SWE,"Net bilateral aid flows from DAC donors, Australia (current US$)",DC.DAC.AUSL.CD,..,..,..,..,..,..,..,..,..,..,..
Sweden,SWE,"Net bilateral aid flows from DAC donors, Austria (current US$)",DC.DAC.AUTL.CD,..,..,..,..,..,..,..,..,..,..,..
Sweden,SWE,"Net bilateral aid flows from DAC donors, Belgium (current US$)",DC.DAC.BELL.CD,..,..,..,..,..,..,..,..,..,..,..
Sweden,SWE,"Net bilateral aid flows from DAC donors, Canada (current US$)",DC.DAC.CANL.CD,..,..,..,..,..,..,..,..,..,..,..
Sweden,SWE,"Net bilateral aid flows from DAC donors, Czechia (current US$)",DC.DAC.CZEL.CD,..,..,..,..,..,..,..,..,..,..,..
Sweden,SWE,"Net bilateral aid flows from DAC donors, Denmark (current US$)",DC.DAC.DNKL.CD,..,..,..,..,..,..,..,..,..,..,..
Sweden,SWE,"Net bilateral aid flows from DAC donors, Estonia (current US$)",DC.DAC.ESTL.CD,..,..,..,..,..,..,..,..,..,..,..
Sweden,SWE,"Net bilateral aid flows from DAC donors, European Union institutions (current US$)",DC.DAC.CECL.CD,..,..,..,..,..,..,..,..,..,..,..
Sweden,SWE,"Net bilateral aid flows from DAC donors, Finland (current US$)",DC.DAC.FINL.CD,..,..,..,..,..,..,..,..,..,..,..
Sweden,SWE,"Net bilateral aid flows from DAC donors, France (current US$)",DC.DAC.FRAL.CD,..,..,..,..,..,..,..,..,..,..,..
Sweden,SWE,"Net bilateral aid flows from DAC donors, Germany (current US$)",DC.DAC.DEUL.CD,..,..,..,..,..,..,..,..,..,..,..
Sweden,SWE,"Net bilateral aid flows from DAC donors, Greece (current US$)",DC.DAC.GRCL.CD,..,..,..,..,..,..,..,..,..,..,..
Sweden,SWE,"Net bilateral aid flows from DAC donors, Hungary (current US$)",DC.DAC.HUNL.CD,..,..,..,..,..,..,..,..,..,..,..
Sweden,SWE,"Net bilateral aid flows from DAC donors, Iceland (current US$)",DC.DAC.ISLL.CD,..,..,..,..,..,..,..,..,..,..,..
Sweden,SWE,"Net bilateral aid flows from DAC donors, Ireland (current US$)",DC.DAC.IRLL.CD,..,..,..,..,..,..,..,..,..,..,..
Sweden,SWE,"Net bilateral aid flows from DAC donors, Italy (current US$)",DC.DAC.ITAL.CD,..,..,..,..,..,..,..,..,..,..,..
Sweden,SWE,"Net bilateral aid flows from DAC donors, Japan (current US$)",DC.DAC.JPNL.CD,..,..,..,..,..,..,..,..,..,..,..
Sweden,SWE,"Net bilateral aid flows from DAC donors, Korea, Rep. (current US$)",DC.DAC.KORL.CD,..,..,..,..,..,..,..,..,..,..,..
Sweden,SWE,"Net bilateral aid flows from DAC donors, Lithuania (current US$)",DC.DAC.LTUL.CD,..,..,..,..,..,..,..,..,..,..,..
Sweden,SWE,"Net bilateral aid flows from DAC donors, Luxembourg (current US$)",DC.DAC.LUXL.CD,..,..,..,..,..,..,..,..,..,..,..
Sweden,SWE,"Net bilateral aid flows from DAC donors, Netherlands (current US$)",DC.DAC.NLDL.CD,..,..,..,..,..,..,..,..,..,..,..
Sweden,SWE,"Net bilateral aid flows from DAC donors, New Zealand (current US$)",DC.DAC.NZLL.CD,..,..,..,..,..,..,..,..,..,..,..
Sweden,SWE,"Net bilateral aid flows from DAC donors, Norway (current US$)",DC.DAC.NORL.CD,..,..,..,..,..,..,..,..,..,..,..
Sweden,SWE,"Net bilateral aid flows from DAC donors, Poland (current US$)",DC.DAC.POLL.CD,..,..,..,..,..,..,..,..,..,..,..
Sweden,SWE,"Net bilateral aid flows from DAC donors, Portugal (current US$)",DC.DAC.PRTL.CD,..,..,..,..,..,..,..,..,..,..,..
Sweden,SWE,"Net bilateral aid flows from DAC donors, Slovak Republic (current US$)",DC.DAC.SVKL.CD,..,..,..,..,..,..,..,..,..,..,..
Sweden,SWE,"Net bilateral aid flows from DAC donors, Slovenia (current US$)",DC.DAC.SVNL.CD,..,..,..,..,..,..,..,..,..,..,..
Sweden,SWE,"Net bilateral aid flows from DAC donors, Spain (current US$)",DC.DAC.ESPL.CD,..,..,..,..,..,..,..,..,..,..,..
Sweden,SWE,"Net bilateral aid flows from DAC donors, Sweden (current US$)",DC.DAC.SWEL.CD,..,..,..,..,..,..,..,..,..,..,..
Sweden,SWE,"Net bilateral aid flows from DAC donors, Switzerland (current US$)",DC.DAC.CHEL.CD,..,..,..,..,..,..,..,..,..,..,..
Sweden,SWE,"Net bilateral aid flows from DAC donors, Total (current US$)",DC.DAC.TOTL.CD,..,..,..,..,..,..,..,..,..,..,..
Sweden,SWE,"Net bilateral aid flows from DAC donors, United Kingdom (current US$)",DC.DAC.GBRL.CD,..,..,..,..,..,..,..,..,..,..,..
Sweden,SWE,"Net bilateral aid flows from DAC donors, United States (current US$)",DC.DAC.USAL.CD,..,..,..,..,..,..,..,..,..,..,..
Sweden,SWE,"Net capital account (BoP, current US$)",BN.TRF.KOGT.CD,-659052594.665214,-835874002.606899,-178143683.199488,-122163217.676773,189347454.212614,1152864972.08708,248025063.798272,142251423.016054,557629357.235528,-72309131.5520594,142563381.701993
Sweden,SWE,Net domestic credit (current LCU),FM.AST.DOMS.CN,6168378000000,6336090000000,6806080000000,7586755000000,7402254000000,7908011000000,8423988000000,8953542000000,10866911000000,10462404000000,10215398000000
Sweden,SWE,"Net errors and omissions (BoP, current US$)",BN.KAC.EOMS.CD,-4671996834.62178,-4918312317.5161,-36128855256.6565,9935798847.58515,-8719794099.48041,-9046843053.93804,-47463369940.0932,9844615727.58306,-27411159144.4057,-4025003216.11542,38453150695.772
Sweden,SWE,"Net financial account (BoP, current US$)",BN.FIN.TOTL.CD,13447876378.711,7258943680.61944,-26810548265.1531,20933882781.2062,3554795656.53083,20455426276.0991,-15609854435.3167,52698483517.5179,551155573.24145,36721644705.4482,83870289214.0238
Sweden,SWE,"Net financial flows, bilateral (NFL, current US$)",DT.NFL.BLAT.CD,..,..,..,..,..,..,..,..,..,..,..
Sweden,SWE,"Net financial flows, IBRD (NFL, current US$)",DT.NFL.MIBR.CD,..,..,..,..,..,..,..,..,..,..,..
Sweden,SWE,"Net financial flows, IDA (NFL, current US$)",DT.NFL.MIDA.CD,..,..,..,..,..,..,..,..,..,..,..
Sweden,SWE,"Net financial flows, IMF concessional (NFL, current US$)",DT.NFL.IMFC.CD,..,..,..,..,..,..,..,..,..,..,..
Sweden,SWE,"Net financial flows, IMF nonconcessional (NFL, current US$)",DT.NFL.IMFN.CD,..,..,..,..,..,..,..,..,..,..,..
Sweden,SWE,"Net financial flows, multilateral (NFL, current US$)",DT.NFL.MLAT.CD,..,..,..,..,..,..,..,..,..,..,..
Sweden,SWE,"Net financial flows, others (NFL, current US$)",DT.NFL.MOTH.CD,..,..,..,..,..,..,..,..,..,..,..
Sweden,SWE,"Net financial flows, RDB concessional (NFL, current US$)",DT.NFL.RDBC.CD,..,..,..,..,..,..,..,..,..,..,..
Sweden,SWE,"Net financial flows, RDB nonconcessional (NFL, current US$)",DT.NFL.RDBN.CD,..,..,..,..,..,..,..,..,..,..,..
Sweden,SWE,"Net flows on external debt, private nonguaranteed (PNG) (NFL, current US$)",DT.NFL.DPNG.CD,..,..,..,..,..,..,..,..,..,..,..
Sweden,SWE,Net foreign assets (current LCU),FM.AST.NFRG.CN,1213446219945.67,1344142899739.47,1359626194382.73,1190631929172.32,723226118570.602,836535468471.206,494107064496.31,346671422984.552,175436372497.148,381530828854.328,541044922348.053
Sweden,SWE,Net ODA provided to the least developed countries (% of GNI),DC.ODA.TLDC.GN.ZS,0.17291907392959,0.167797790408169,0.160983478361477,0.187327391006571,0.209802890093664,0.197966929399137,0.199408272867212,0.205610855734873,0.168579614732037,..,..
Sweden,SWE,"Net ODA provided, to the least developed countries (current US$)",DC.ODA.TLDC.CD,984790000,846940000,837490000,1022840000,1174620000,1077670000,1111560000,1345590000,1032410000,..,..
Sweden,SWE,"Net ODA provided, total (% of GNI)",DC.ODA.TOTL.GN.ZS,1.094402,1.404549,0.940681,1.018878,..,..,..,..,..,..,..
Sweden,SWE,"Net ODA provided, total (constant 2021 US$)",DC.ODA.TOTL.KD,5828311967,7972981767,5500296901,6118811666,6553917320,6033317989,7024093270,5934170000,6053386415,..,..
Sweden,SWE,"Net ODA provided, total (current US$)",DC.ODA.TOTL.CD,6232720000,7089300000,4893740000,5563250000,6000040000,5204710000,6348350000,5934170000,5457970000,..,..
Sweden,SWE,Net ODA received (% of central government expense),DT.ODA.ODAT.XP.ZS,..,..,..,..,..,..,..,..,..,..,..
Sweden,SWE,Net ODA received (% of GNI),DT.ODA.ODAT.GN.ZS,..,..,..,..,..,..,..,..,..,..,..
Sweden,SWE,Net ODA received (% of gross capital formation),DT.ODA.ODAT.GI.ZS,..,..,..,..,..,..,..,..,..,..,..
Sweden,SWE,"Net ODA received (% of imports of goods, services and primary income)",DT.ODA.ODAT.MP.ZS,..,..,..,..,..,..,..,..,..,..,..
Sweden,SWE,Net ODA received per capita (current US$),DT.ODA.ODAT.PC.ZS,..,..,..,..,..,..,..,..,..,..,..
Sweden,SWE,Net official aid received (constant 2021 US$),DT.ODA.OATL.KD,..,..,..,..,..,..,..,..,..,..,..
Sweden,SWE,Net official aid received (current US$),DT.ODA.OATL.CD,..,..,..,..,..,..,..,..,..,..,..
Sweden,SWE,Net official development assistance and official aid received (constant 2021 US$),DT.ODA.ALLD.KD,..,..,..,..,..,..,..,..,..,..,..
Sweden,SWE,Net official development assistance and official aid received (current US$),DT.ODA.ALLD.CD,..,..,..,..,..,..,..,..,..,..,..
Sweden,SWE,Net official development assistance received (constant 2021 US$),DT.ODA.ODAT.KD,..,..,..,..,..,..,..,..,..,..,..
Sweden,SWE,Net official development assistance received (current US$),DT.ODA.ODAT.CD,..,..,..,..,..,..,..,..,..,..,..
Sweden,SWE,"Net official flows from UN agencies, CERF (current US$)",DT.NFL.CERF.CD,..,..,..,..,..,..,..,..,..,..,..
Sweden,SWE,"Net official flows from UN agencies, FAO (current US$)",DT.NFL.FAOG.CD,..,..,..,..,..,..,..,..,..,..,..
Sweden,SWE,"Net official flows from UN agencies, IAEA (current US$)",DT.NFL.IAEA.CD,..,..,..,..,..,..,..,..,..,..,..
Sweden,SWE,"Net official flows from UN agencies, IFAD (current US$)",DT.NFL.IFAD.CD,..,..,..,..,..,..,..,..,..,..,..
Sweden,SWE,"Net official flows from UN agencies, ILO (current US$)",DT.NFL.ILOG.CD,..,..,..,..,..,..,..,..,..,..,..
Sweden,SWE,"Net official flows from UN agencies, SDGFUND (current US$)",DT.NFL.SDGF.CD,..,..,..,..,..,..,..,..,..,..,..
Sweden,SWE,"Net official flows from UN agencies, SPRP (current US$)",DT.NFL.SPRP.CD,..,..,..,..,..,..,..,..,..,..,..
Sweden,SWE,"Net official flows from UN agencies, UNAIDS (current US$)",DT.NFL.UNAI.CD,..,..,..,..,..,..,..,..,..,..,..
Sweden,SWE,"Net official flows from UN agencies, UNCDF (current US$)",DT.NFL.UNCD.CD,..,..,..,..,..,..,..,..,..,..,..
Sweden,SWE,"Net official flows from UN agencies, UNCOVID (current US$)",DT.NFL.UNCV.CD,..,..,..,..,..,..,..,..,..,..,..
Sweden,SWE,"Net official flows from UN agencies, UNCTAD (current US$)",DT.NFL.UNCTAD.CD,..,..,..,..,..,..,..,..,..,..,..
Sweden,SWE,"Net official flows from UN agencies, UNDP (current US$)",DT.NFL.UNDP.CD,..,..,..,..,..,..,..,..,..,..,..
Sweden,SWE,"Net official flows from UN agencies, UNECE (current US$)",DT.NFL.UNEC.CD,..,..,..,..,..,..,..,..,..,..,..
Sweden,SWE,"Net official flows from UN agencies, UNEP (current US$)",DT.NFL.UNEP.CD,..,..,..,..,..,..,..,..,..,..,..
Sweden,SWE,"Net official flows from UN agencies, UNFPA (current US$)",DT.NFL.UNFP.CD,..,..,..,..,..,..,..,..,..,..,..
Sweden,SWE,"Net official flows from UN agencies, UNHCR (current US$)",DT.NFL.UNCR.CD,..,..,..,..,..,..,..,..,..,..,..
Sweden,SWE,"Net official flows from UN agencies, UNICEF (current US$)",DT.NFL.UNCF.CD,..,..,..,..,..,..,..,..,..,..,..
Sweden,SWE,"Net official flows from UN agencies, UNIDIR (current US$)",DT.NFL.UNID.CD,..,..,..,..,..,..,..,..,..,..,..
Sweden,SWE,"Net official flows from UN agencies, UNIDO (current US$)",DT.NFL.UNIDO.CD,..,..,..,..,..,..,..,..,..,..,..
Sweden,SWE,"Net official flows from UN agencies, UNPBF (current US$)",DT.NFL.UNPB.CD,..,..,..,..,..,..,..,..,..,..,..
Sweden,SWE,"Net official flows from UN agencies, UNRWA (current US$)",DT.NFL.UNRW.CD,..,..,..,..,..,..,..,..,..,..,..
Sweden,SWE,"Net official flows from UN agencies, UNTA (current US$)",DT.NFL.UNTA.CD,..,..,..,..,..,..,..,..,..,..,..
Sweden,SWE,"Net official flows from UN agencies, UNWOMEN (current US$)",DT.NFL.UNWN.CD,..,..,..,..,..,..,..,..,..,..,..
Sweden,SWE,"Net official flows from UN agencies, UNWTO (current US$)",DT.NFL.UNWT.CD,..,..,..,..,..,..,..,..,..,..,..
Sweden,SWE,"Net official flows from UN agencies, WFP (current US$)",DT.NFL.WFPG.CD,..,..,..,..,..,..,..,..,..,..,..
Sweden,SWE,"Net official flows from UN agencies, WHO (current US$)",DT.NFL.WHOL.CD,..,..,..,..,..,..,..,..,..,..,..
Sweden,SWE,"Net official flows from UN agencies, WTO-ITC (current US$)",DT.NFL.WITC.CD,..,..,..,..,..,..,..,..,..,..,..
Sweden,SWE,"Net primary income (BoP, current US$)",BN.GSR.FCTY.CD,10738457269.4527,2884297179.64503,859032027.501122,7555624014.4897,9964785532.38525,15484878758.4964,19196511257.8608,24788123820.3558,23652028561.8181,25003968480.5214,26771131409.1166
Sweden,SWE,Net primary income (Net income from abroad) (constant LCU),NY.GSR.NFCY.KN,84488577000,30163000000,11243613000,62581714000,80826676000,133229243000,158678478000,195476924000,206009715000,176726167000,..
Sweden,SWE,Net primary income (Net income from abroad) (current LCU),NY.GSR.NFCY.CN,82972000000,30163000000,11411000000,65096000000,86635000000,146057000000,177056000000,223553000000,252161000000,230124000000,..
Sweden,SWE,Net primary income (Net income from abroad) (current US$),NY.GSR.NFCY.CD,12093659836.3015,3576001088.343,1332750654.7834,7614581786.87161,9966616885.67046,15442123929.4842,19223676366.7372,26065558328.9556,24931257201.3469,21689019946.8267,..
Sweden,SWE,"Net secondary income (BoP, current US$)",BN.TRF.CURR.CD,-10205715633.3982,-7989039749.84934,-6636630786.5359,-7983148561.36703,-8894376576.23973,-10260868809.0292,-11432847768.2198,-11497670743.3773,-10349419478.1815,-9322771422.94462,-10822369460.485
Sweden,SWE,Net secondary income (Net current transfers from abroad) (constant LCU),NY.TRF.NCTR.KN,..,..,..,..,..,..,..,..,..,..,..
Sweden,SWE,Net secondary income (Net current transfers from abroad) (current LCU),NY.TRF.NCTR.CN,-69409000000,-66878000000,-56358000000,-67836000000,-76592000000,-95798000000,-104931000000,-97806000000,-102728000000,-99992000000,..
Sweden,SWE,Net secondary income (Net current transfers from abroad) (current US$),NY.TRF.NCTR.CD,-10116772351.8519,-7928780319.80252,-6582346981.18331,-7935092326.62871,-8811255503.05618,-10128405952.4482,-11392777340.7176,-11403863951.3754,-10156757745.1706,-9424173413.12987,..
Sweden,SWE,"Net trade in goods (BoP, current US$)",BN.GSR.MRCH.CD,19008474124.6292,14388927855.1942,11639020561.4806,13172493010.3701,13125657563.3382,22604589067.2674,25855576704.0983,30535929893.2803,23563763165.0584,33422264157.2668,..
Sweden,SWE,"Net trade in goods and services (BoP, current US$)",BN.GSR.GNFS.CD,18246315684.568,18118110226.2481,15274041856.9726,11547184497.3353,11014490874.811,23125394624.9601,23842043077.7926,29421157109.3754,14101881421.7174,25314147440.5633,..
Sweden,SWE,"Official exchange rate (LCU per US$, period average)",PA.NUS.FCRF,6.860785,8.43484083333333,8.56199166666667,8.54886083333333,8.69251833333333,9.45834916666667,9.21030902842085,8.57656671607378,10.114251277564,10.6101612965536,10.5676364344775
Sweden,SWE,Other manufacturing (% of value added in manufacturing),NV.MNF.OTHR.ZS.UN,61.1856577799496,61.0491054578395,60.9147667406461,62.5031982245997,62.4631489781762,63.0647411876839,61.3763674068649,64.2316830186467,..,..,..
Sweden,SWE,"Personal remittances, paid (current US$)",BM.TRF.PWKR.CD.DT,1791977957.34409,2429287325.59419,2858462903.50704,3571781225.0218,3688730695.12669,3368050650.88684,3152099431.6817,3844635254.37924,3938783464.77102,4201758685.09727,..
Sweden,SWE,"Personal remittances, received (% of GDP)",BX.TRF.PWKR.DT.GD.ZS,0.811792429411145,0.753037681871652,0.620732236961208,0.608075132257993,0.59366920855835,0.635929324633191,0.599084789000899,0.511973354141723,0.63779019840825,0.713010565926109,..
Sweden,SWE,"Personal remittances, received (current US$)",BX.TRF.PWKR.CD.DT,4689970392.57994,3777976974.35937,3191918176.86581,3259793128.55943,3272972546.11362,3384220598.29468,3265896438.89928,3262227168.87979,3698518046.20896,4170829998.71263,..
Sweden,SWE,"Personal transfers, receipts (BoP, current US$)",BX.TRF.PWKR.CD,413554509.741159,354046931.34366,365474626.029153,385007458.63887,396163197.717714,377465686.288755,338356895.154342,354570231.448454,362681875.208486,343586376.775026,343834066.874145
Sweden,SWE,"PNG, bonds (NFL, current US$)",DT.NFL.PNGB.CD,..,..,..,..,..,..,..,..,..,..,..
Sweden,SWE,"PNG, commercial banks and other creditors (NFL, current US$)",DT.NFL.PNGC.CD,..,..,..,..,..,..,..,..,..,..,..
Sweden,SWE,"Portfolio equity, net inflows (BoP, current US$)",BX.PEF.TOTL.CD.WD,2007944855.29511,1926800190.96274,-3047369374.18492,3259905209.3765,46479960.393408,1147073389.49473,7374259068.16701,17874411771.5879,-20114318712.9339,-2380163751.6368,..
Sweden,SWE,"Portfolio investment, bonds (PPG + PNG) (NFL, current US$)",DT.NFL.BOND.CD,..,..,..,..,..,..,..,..,..,..,..
Sweden,SWE,"Portfolio investment, net (BoP, current US$)",BN.KLT.PTXL.CD,23471019154.1058,-13132270344.3832,6307394456.19438,3858366621.67701,-10655491353.3795,15033267344.3167,-7289816808.52791,66724921762.8075,-23223213389.9776,-3198725194.08895,55460871102.9204
Sweden,SWE,Poverty gap at $3.00 a day (2021 PPP) (%),SI.POV.GAPS,0.4,0.3,0.2,0.2,0.6,0.2,0.3,0.5,0.9,..,..
Sweden,SWE,Poverty gap at $4.20 a day (2021 PPP) (%),SI.POV.LMIC.GP,0.4,0.5,0.3,0.2,0.7,0.3,0.4,0.6,1,..,..
Sweden,SWE,Poverty gap at $8.30 a day (2021 PPP) (%),SI.POV.UMIC.GP,0.7,0.7,0.5,0.4,1,0.5,0.5,0.9,1.3,..,..
Sweden,SWE,Poverty headcount ratio at $3.00 a day (2021 PPP) (% of population),SI.POV.DDAY,0.5,0.6,0.4,0.3,0.9,0.4,0.5,0.6,1.3,..,..
Sweden,SWE,Poverty headcount ratio at $4.20 a day (2021 PPP) (% of population),SI.POV.LMIC,0.7,0.8,0.5,0.3,0.9,0.4,0.5,0.9,1.4,..,..
Sweden,SWE,Poverty headcount ratio at $8.30 a day (2021 PPP) (% of population),SI.POV.UMIC,1.2,1.2,1,0.8,1.5,1,1,1.5,1.7,..,..
Sweden,SWE,Poverty headcount ratio at national poverty lines (% of population),SI.POV.NAHC,16.3,16.2,15.8,16.4,17.1,16.1,15.7,16,16.1,..,..
Sweden,SWE,Poverty headcount ratio at societal poverty line (% of population),SI.POV.SOPO,10.5,11,11.6,11,11.7,11.4,11,12.1,12.5,..,..
Sweden,SWE,"PPG, bonds (NFL, current US$)",DT.NFL.PBND.CD,..,..,..,..,..,..,..,..,..,..,..
Sweden,SWE,"PPG, commercial banks (NFL, current US$)",DT.NFL.PCBK.CD,..,..,..,..,..,..,..,..,..,..,..
Sweden,SWE,"PPG, IBRD (DOD, current US$)",DT.DOD.MIBR.CD,..,..,..,..,..,..,..,..,..,..,..
Sweden,SWE,"PPG, IDA (DOD, current US$)",DT.DOD.MIDA.CD,..,..,..,..,..,..,..,..,..,..,..
Sweden,SWE,"PPG, official creditors (NFL, US$)",DT.NFL.OFFT.CD,..,..,..,..,..,..,..,..,..,..,..
Sweden,SWE,"PPG, other private creditors (NFL, current US$)",DT.NFL.PROP.CD,..,..,..,..,..,..,..,..,..,..,..
Sweden,SWE,"PPG, private creditors (NFL, US$)",DT.NFL.PRVT.CD,..,..,..,..,..,..,..,..,..,..,..
Sweden,SWE,"PPP conversion factor, GDP (LCU per international $)",PA.NUS.PPP,8.727131,8.852008,8.822586,8.852247,8.865881,8.584015,8.435616,8.363733,8.426093,8.765773,8.819193
Sweden,SWE,"PPP conversion factor, private consumption (LCU per international $)",PA.NUS.PRVT.PP,9.122638,9.301321,9.324154,9.483893,9.470321,9.282849,9.186234,9.046399,8.794449,9.02211,..
Sweden,SWE,"Present value of external debt (% of exports of goods, services and primary income)",DT.DOD.PVLX.EX.ZS,..,..,..,..,..,..,..,..,..,..,..
Sweden,SWE,Present value of external debt (% of GNI),DT.DOD.PVLX.GN.ZS,..,..,..,..,..,..,..,..,..,..,..
Sweden,SWE,Present value of external debt (current US$),DT.DOD.PVLX.CD,..,..,..,..,..,..,..,..,..,..,..
Sweden,SWE,Price level ratio of PPP conversion factor (GDP) to market exchange rate,PA.NUS.PPPC.RF,1.27203097021696,1.04945762165637,1.03043618161273,1.03548849052306,1.01994389427997,0.90755953800606,0.915888486908492,0.975184275582571,0.833091127436317,0.826167741940672,..
Sweden,SWE,"Primary income payments (BoP, current US$)",BM.GSR.FCTY.CD,53420049808.6339,43581417143.7003,43578181214.9957,41915671293.8552,49056154489.9781,43469262804.9976,35535046517.6284,48408812218.6802,51457872249.2561,64719328127.9142,..
Sweden,SWE,"Primary income receipts (BoP, current US$)",BX.GSR.FCTY.CD,64158200965.9863,46465714323.3454,44437095126.3548,49471415481.009,59021051787.5076,58954245571.2238,54731557775.4892,73195528464.6806,75084641928.9086,89704825848.7758,..
Sweden,SWE,Proportion of people living below 50 percent of median income (%),SI.DST.50MD,9.3,9.6,10.4,10.1,10.8,10.2,10.1,11.1,11.4,..,..
Sweden,SWE,Prosperity gap (average shortfall from a prosperity standard of $28/day),SI.SPR.PGAP,0.9,0.9,0.9,0.7,1.2,0.8,0.9,1.1,1.4,..,..
Sweden,SWE,"Public and publicly guaranteed debt service (% of exports of goods, services and primary income)",DT.TDS.DPPG.XP.ZS,..,..,..,..,..,..,..,..,..,..,..
Sweden,SWE,Public and publicly guaranteed debt service (% of GNI),DT.TDS.DPPG.GN.ZS,..,..,..,..,..,..,..,..,..,..,..
Sweden,SWE,Real effective exchange rate index (2010 = 100),PX.REX.REER,100.783895363283,93.2431470558493,93.9401821071996,93.1230734109669,89.2642782796605,85.7051425735126,87.7136942231592,90.2741734692389,84.8509487312802,83.4404315256319,..
Sweden,SWE,Real interest rate (%),FR.INR.RINR,..,..,..,..,..,..,..,..,..,..,..
Sweden,SWE,"Reserves and related items (BoP, current US$)",BN.RES.INCL.CD,485739702.315463,1310965160.65334,4381767896.08999,137870090.992705,73685151.15229,-6748212482.00467,-585190207.352395,6241062912.93112,7946002616.41526,-5742528877.35793,..
Sweden,SWE,"Risk premium on lending (lending rate minus treasury bill rate, %)",FR.INR.RISK,..,..,..,..,..,..,..,..,..,..,..
Sweden,SWE,S&P Global Equity Indices (annual % change),CM.MKT.INDX.ZG,-8.58617833482405,-1.57193368795521,-1.46514407226561,18.0370480220497,-15.2732025467396,23.1369131258477,31.4651120170903,15.9064600023185,-35.079659770687,..,..
Sweden,SWE,"Secondary income receipts (BoP, current US$)",BX.TRF.CURR.CD,6329790265.5859,5748423046.6792,6485155043.50758,6721834111.56171,7212183292.41462,7016566112.02918,5603867899.89205,7674420951.66308,7092919874.88396,7601726592.1929,7338588700.23833
Sweden,SWE,"Secondary income, other sectors, payments (BoP, current US$)",BM.TRF.PRVT.CD,7144057409.03108,5914372418.30963,6319893040.02725,7032576359.45663,6966571003.98832,8788353196.67096,7029177040.2598,7913674390.31466,8091019195.77224,8274700880.99068,8877314546.53732
Sweden,SWE,"Service exports (BoP, current US$)",BX.GSR.NFSV.CD,75402598981.7026,72508626000.2369,74148890776.0256,73851517735.4499,76392545777.9342,81849412470.9915,72575989691.1306,91023100102.6242,97020894197.5465,105003807554.183,..
Sweden,SWE,"Service imports (BoP, current US$)",BM.GSR.NFSV.CD,76165052819.1497,68779325758.3082,70513751364.3916,75476471226.2228,78503712466.4614,81328606913.2988,74589523317.4362,92137753750.773,106482682746.697,113111736000.493,..
Sweden,SWE,"Services, value added (% of GDP)",NV.SRV.TOTL.ZS,65.9159423193025,65.1916644315761,65.2445345299237,64.9976750564653,64.992318918664,65.1167799059212,65.6685809019677,64.5633496533133,63.7124393308271,65.2205380627646,..
Sweden,SWE,"Services, value added (annual % growth)",NV.SRV.TOTL.KD.ZG,3.09915791467255,3.6129849290752,2.78108407989865,1.64721201944447,2.29912932659988,2.9362339890283,-2.74534833158664,4.96818437619974,1.59746228060898,0.856898374035481,..
Sweden,SWE,"Services, value added (constant 2015 US$)",NV.SRV.TOTL.KD,315660675833.737,327065448478.627,336161413597.115,341698704806.621,349554799937.442,359818546783.485,349940274312.625,367325952347.056,373193845882.688,376391737880.057,..
Sweden,SWE,"Services, value added (constant LCU)",NV.SRV.TOTL.KN,2662547558000,2758745000000,2835468018000,2882174188000,2948439100000,3035012171000,2951690515000,3098335942000,3147830690000,3174804400000,..
Sweden,SWE,"Services, value added (current LCU)",NV.SRV.TOTL.CN,2612699000000,2758745000000,2872542000000,2978783000000,3114623000000,3277616000000,3297205000000,3528307000000,3736869000000,4047929000000,..
